{
  "@context": "https://obligationfirst.org/v1/",
  "@type": "of:Allegation",
  "@id": "https://obligationfirst.org/v1/examples/air-canada/allegation/moffatt-reliance",
  "asserted_by": "claimant",
  "text": "Claimant relied on the chatbot's answer, purchased tickets, and was denied the bereavement discount when he subsequently requested it."
}
